url,title,tag,time,short_text,long_text
"https://www.reuters.com/article/us-india-brainsurgery-idUSKBN1A61UQ","Indian musician plays guitar as doctors perform brain surgery","","Jul 21 2017","Musician Abhishek Prasad strummed his guitar throughout his neurosurgery to help doctors zero in on the part of the brain being operated on during the first such procedure in India.","(Reuters) - Musician Abhishek Prasad strummed his guitar throughout his neurosurgery to help doctors zero in on the part of the brain being operated on during the first such procedure in India. The 37-year-old had been suffering from musician's dystonia, a neurological movement disorder which leads to involuntary muscle contractions.  Prasad had to be kept conscious during the surgery as the doctors needed continuous feedback to work out exactly which parts of the brain were to be targeted to stop the cramps affecting the three fingers on his left hand. So the obvious thing was to play his guitar. It is only the eighth time in the world that such a procedure has been undertaken with the patient being conscious, a statement by Bengaluru's Bhagwan Mahaveer Jain hospital said on Friday. A 14-mm hole was made in the skull and a specialized electrode was passed into the brain under local anesthesia, Sharan Srinivasan, a stereotactic and functional neurosurgeon at the hospital, said. Prasad was overwhelmed with the outcome after suffering since October 2015 with the disorder that could have ended his career.  He had tried several hospitals to find a cure, but most doctors could not diagnose the problem or had focused on the cramps rather than the neurological activity causing them. It was a very emotional moment for me and my family. This is what I have been waiting for, said Prasad, who had quit his IT job to pursue a career in music. It was very disheartening and depressing for me. I used to cry often due to that. Every morning I would wake up and try to play the guitar. But after 5 minutes, I gave up. The disorder is estimated to affect around 1-2 percent of all professional musicians. After the surgery on July 11, he will need a couple of weeks of physiotherapy to help his recovery and get back to performing pain-free. My first target is to release an album by the end of this year or the middle of next year, Prasad said. Reporting by Zeyad Masroor Khan; Editing by Malini Menon"
"https://www.reuters.com/article/us-corning-glass-idUSKBN1A52MJ","Trump unveils companies' $500 million U.S. drug packaging project","","Jul 21 2017","President Donald Trump on Thursday announced a $500 million investment that Corning Inc is making with pharmaceutical giants Merck and Pfizer to manufacture a new kind of glass for injectable drug vials.","WASHINGTON (Reuters) - President Donald Trump on Thursday announced a $500 million investment that Corning Inc is making with pharmaceutical giants Merck and Pfizer to manufacture a new kind of glass for injectable drug vials. At a White House event, Trump said the effort will create nearly 1,000 jobs at facilities in New York and New Jersey and at a soon-to-be-determined site in the southeastern United States. The deal could eventually result in a total investment of $4 billion and create around 4,000 jobs, Trump said, joined by the CEOs of Corning, Merck and Pfizer. The commitments were made as part of Trump's Made in America week, during which he has showcased American-made products and made an impassioned defense of his America First policies. Corning said it developed the new type of glass in collaboration with the drugmakers. This initiative will bring a key industry to our shores that for too long has been dominated by foreign countries. We’re moving more and more companies back into the United States, Trump said. After the remarks, Trump tested the strength of the new Corning Valor Vial. Pressing down on an old vial in a vise-like machine, he easily broke it but struggled to break one of the new vials despite putting far greater effort into it. Reporting by Steve Holland in Washington and Michael Erman; in New York; Editing by Bernadette Baum and Cynthia Osterman"
"https://www.reuters.com/article/us-kenya-cholera-idUSKBN1A61HU","WHO sees high risk from Kenya cholera outbreak","","Jul 21 2017","An outbreak of cholera in Kenya poses a high risk to the region and a moderate threat globally, the World Health Organization said on Friday, after delegates at two international conferences were hit.","GENEVA (Reuters) - An outbreak of cholera in Kenya poses a high risk to the region and a moderate threat globally, the World Health Organization said on Friday, after delegates at two international conferences were hit. The spread of the disease has surged since April, affecting the capital Nairobi, a major hub for conferences in Africa, and the large refugee camps of Dadaab and Kakuma. The disease, which is spread by ingesting fecal matter, hit 146 at a conference in Nairobi on June 22, and a further 136 people at the China Trade Fair on July 10-12, one of whom died. In total, the disease, which causes acute watery diarrhea and can kill within hours if not treated, registered 1,216 suspected cases and 14 deaths between the start of the year and July 17.  The risk of the current outbreak is assessed as high at national and regional levels and moderate at global level, WHO said in a disease outbreak news item. Cholera is reported in Kenya every year but large cyclical epidemics normally come every five to seven years, it said. Kenya holds elections for the presidency, the legislature and local seats on Aug. 8. Reporting by Tom Miles; Editing by Alison Williams"
"https://www.reuters.com/article/us-yemen-cholera-who-idUSKBN1A61GY","Yemen cholera to spread with rains; Oxfam sees 600,000 cases","","Jul 21 2017","Yemen's cholera outbreak is far from being controlled and may  be further exacerbated by the rainy season, even if the rate of new cases appears to be slowing in some hotspots, the World Health Organisation said on Friday.","GENEVA (Reuters) - Yemen's cholera outbreak is far from being controlled and may  be further exacerbated by the rainy season, even if the rate of new cases appears to be slowing in some hotspots, the World Health Organisation said on Friday.   Oxfam projected the number could rise to more than 600,000 cases, the largest ever recorded in any country in a single year since records began, exceeding Haiti in 2011.  Nigel Timmins, the charity's humanitarian director who has just returned from the country, said: Cholera has spread unchecked in a country already on its knees after two years of war and which is teetering on the brink of famine. For many people, weakened by war and hunger, cholera is the knockout blow. The WHO reported 368,207 suspected cases and 1,828 deaths  in the Arabian Peninsula country since late April. Every day we have 5,000 more Yemenis falling sick with symptoms of acute watery diarrhoea or cholera, WHO spokeswoman Fadela Chaib told a news briefing in Geneva. Yemen's cholera outbreak is far from being controlled, the rainy season has just started and may increase the paths of transmission. Sustained efforts are required to stop the spread of this disease, she said. Millions are malnourished in Yemen where famine looms, the United Nations says. A Saudi Arabia-led coalition intervened in Yemen's civil war in 2015, backing government forces fighting Iran-allied Houthi rebels and fighting limits access for aid workers. Surveillance data confirms a slight decline in suspected cases over the past two weeks in some of the most affected governorates - Amanat Al Asimah, Amran and Sana'a, Chaib said.  But great caution was called for as there is a backlog in reporting and data is still being analyzed, she said.  Oxfam, which is based in Britain, said Yemen's rainy season from July to September would increase the risk of the disease spreading further through water contaminated with faeces. It is feared that the total number of people infected could eventually rise to over 600,000, making it one of the largest outbreaks since records began in 1949, Oxfam said. The WHO did not provide its latest planning figure. The fighting is hugely exacerbating the ability to stop this epidemic of cholera. The kind of disintegration of the health system in Yemen as a result of the conflict at a time of cholera is an absolutely lethal combination, U.N. human rights spokesman Rupert Colville told Friday's briefing. Reporting and writing by Stephanie Nebehay; Additional reporting by Tom Miles; Editing by Alison Williams"
"https://www.reuters.com/article/us-daiichi-sankyo-onzeald-idUSKBN1A61EI","EMA panel recommends against Nektar, Daiichi Sankyo's breast cancer drug","","Jul 21 2017","European regulators on Friday recommended against granting approval to a breast cancer drug being developed by Nektar Therapeutics and Daiichi Sankyo's German unit.","(Reuters) - European regulators on Friday recommended against granting approval to a breast cancer drug being developed by Nektar Therapeutics and Daiichi Sankyo's German unit. The European Medicines Agency (EMA) said its committee of experts refused authorization to market the investigational drug, Onzeald, as a first-line treatment for adults with advanced breast cancer who have already received other treatment. One of the main concerns raised by the committee was that the benefit of Onzeald to treat breast cancer that had spread to the brain had not been sufficiently demonstrated.  Reporting by Justin George Varghese in Bengaluru; Editing by Sriraj Kalluvila"
"https://www.reuters.com/article/us-janssen-hiv-idUSKBN1A61DC","Janssen-Cilag's HIV drug gets EU regulatory panel's nod","","Jul 21 2017","A European regulatory panel recommended granting approval to a treatment for HIV infection developed by Janssen-Cilag International, a unit of U.S. drugmaker Johnson & Johnson.","(Reuters) - A European regulatory panel recommended granting approval to a treatment for HIV infection developed by Janssen-Cilag International, a unit of U.S. drugmaker Johnson & Johnson. The drug, Symtuza, is a combination of four active substances darunavir, cobicistat, emtricitabine and tenofovir alafenamide. (bit.ly/2gPiBAD) The human immunodeficiency virus (HIV), which causes AIDS, interferes with the body's ability to fight infections. More than 35 million people have died from AIDS-related illnesses and an estimated 78 million have become infected with HIV, since the disease surfaced 36 years ago. Reporting by Rahul B in Bengaluru; Editing by Saumyadeb Chakrabarty"
"https://www.reuters.com/article/us-pfizer-merck-cancer-idUSKBN1A61C9","Pfizer, Merck KGaA skin cancer drug gets EMA nod for approval","","Jul 21 2017","European regulators on Friday recommended approving Pfizer Inc and Merck KGaA's immuno-oncology drug Bavencio to treat a rare type of skin cancer called Merkel cell carcinoma.","(Reuters) - European regulators on Friday recommended approving Pfizer Inc and Merck KGaA's immuno-oncology drug Bavencio to treat a rare type of skin cancer called Merkel cell carcinoma. In May, Bavencio was approved by the U.S. Food and Drug Administration to treat bladder cancer and in March to treat Merkel cell carcinoma. (bit.ly/2vIbPPG)  Bavencio, known chemically as avelumab, belongs to a class of drugs called PD-L1 or PD-1 inhibitors that help the immune system to attack cancer by blocking a mechanism tumors use to evade detection. Recommendations for marketing approval by the European Medicines Agency's (EMA) Committee for Medicinal Products for Human Use (CHMP) are normally endorsed by the European Commission within a couple of months. Reporting by Noor Zainab Hussain in Bengaluru; Editing by Martina D'Couto"
"https://www.reuters.com/article/us-novartis-leukemia-approval-idUSKBN1A61BW","EU medicines agency recommends approval of Novartis leukaemia drug Rydapt","","Jul 21 2017","A European Medicines Agency (EMA) panel recommended on Friday approval of a new Novartis drug to be used against a tough-to-cure form of blood cancer as the Swiss drugmaker makes headway on refreshing its oncology portfolio.","ZURICH (Reuters) - A European Medicines Agency (EMA) panel recommended on Friday approval of a new Novartis drug to be used against a tough-to-cure form of blood cancer as the Swiss drugmaker makes headway on refreshing its oncology portfolio.  The EMA's Committee for Medicinal Products for Human Use (CHMP) backed Rydapt against acute myeloid leukaemia (AML) in newly diagnosed patients and three other indications. Rydapt was also recommended as a treatment for adults with advanced systemic mastocytosis, a rare disease in which the body's mast cells accumulate rapidly. This latest CHMP opinion sets the stage for likely European Commission approval this year. Rydapt, whose U.S. wholesale cost is nearly $7,500 for a two-week supply, was approved by the U.S. Food and Drug Administration in April. Novartis is rebuilding its portfolio of cancer drugs after the expiration of patents on its blockbuster Gleevec in early 2016 exposed the $5 billion-a-year seller to generics from rivals including Sun Pharmaceuticals.  AML is a rare and aggressive cancer of the blood and bone marrow.  Other recent Novartis approvals or regulator recommendations have included Kisqali against a tough-to-treat form of breast cancer. The company is also aiming for the FDA's blessing for its first-of-its-kind cell therapy CTL019 this year. Novartis is banking on these cancer medications as well as heart failure drug Entresto, psoriasis treatment Cosentyx and its Sandoz unit's growing portfolio of biosimilars to help return it to sales growth starting in 2018. Reporting by John Miller and John Revill; editing by Jason Neely"
"https://www.reuters.com/article/us-china-lgbt-idUSKBN1A616B","LGBT conference in China's 'gay capital' scuppered","","Jul 21 2017","Organizers of an LGBT conference in China's gay capital had to scrap the event this week, the second time in as many months a public seminar aimed at expanding awareness of lesbian, gay bisexual and transgender (LGBT) issues has run into snags.","BEIJING (Reuters) - Organizers of an LGBT conference in China's gay capital had to scrap the event this week, the second time in as many months a public seminar aimed at expanding awareness of lesbian, gay bisexual and transgender (LGBT) issues has run into snags.  The Chinese group Speak Out was due to hold a conference in the city of Chengdu, in Sichuan province, on July 23. But the venue canceled the booking, citing conflicting events, the group said. It is not illegal to be gay in China but LGBT activists say deeply conservative attitudes toward homosexuality in some sections of society have led to occasional government clamp-downs. In May, the lesbian dating app Rela was shut down, though it was not yet clear why. Many people were surprised by the cancellation. Many young Chinese people regard Chengdu as gaydu, or the city of the gays, due to its liberal LGBT views.  The conference venue Jinsha theater told us that a government official activity was scheduled to be held on the same day, which left us with no choice but to cancel, the founder of Speak Out, who gave his name only as Matthew, told Reuters.  An office administrator at the theater told Reuters she was not aware of the situation.  Speak Out ran into similar problems when it tried to organize a gay rights conference in the city of Xian in late May. The local state security bureau in Chengdu has also been in touch with us by phone in recent days, asking questions such as what is our next move on the arrangement for any event and what we are going to talk about at the event, Matthew said.  The Chengdu government information office could not be reached by telephone for comment.  The cancellation prompted hundreds of postings on the Weibo social media platform, with many people expressing sympathy.  Cheer up, the dawn comes after hard struggles in the dark. We shall see each other someday, wrote one Weibo user.  Peng Yanhui, a prominent LGBT activist, was scheduled to call for an end to gay therapy at the conference.  Some gay people are forced by their parents or wives to be treated in hospitals where they are diagnosed as having sexual preference disorder. Many are forced to take drugs or even undergo electro-shock treatments. In 2014, Peng sued a conversion therapy clinic over the suffering he went through and won. Authorities made the clinic remove advertisements for its service from the internet. I felt very sorry for the cancellation, Peng told Reuters.  Until 2001, China had regarded homosexuality as a mental disorder.   Reporting by Ryan Woo, Lusha Zhang and Stella Qiu; Editing by Robert Birsel"
"https://www.reuters.com/article/us-usa-healthcare-idUSKBN1A52L4","Senate Republicans complain of chaos in healthcare effort","","Jul 20 2017","U.S. Senate Republicans, scolded by President Donald Trump for failing to overturn Obamacare, tried to salvage their seven-year effort for a new healthcare law on Thursday, but leading senators indicated frustration over shifting goal posts.","WASHINGTON (Reuters) - U.S. Senate Republicans, scolded by President Donald Trump for failing to overturn Obamacare, tried to salvage their seven-year effort for a new healthcare law on Thursday, but leading senators indicated frustration over shifting goal posts. Trump on Wednesday told the Senate's fractured Republican majority to revive a bill to repeal and replace Obamacare that collapsed on Monday after Republicans from both moderate and conservative factions pulled their support. But after a late-night emergency meeting on how to win over holdouts appeared to yield no progress, senators expressed irritation.  It really is starting to feel like a bazaar, $50 billion here, $100 billion there, and I feel like it’s losing coherency, Senator Bob Corker said. Susan Collins, a moderate Republican who strongly objected to the revised bill, said she didn't even know what we are proceeding to next week and said Trump had contributed to the lack of clarity over the next steps.  I’m unclear, having heard the president and read his tweets, exactly which bill he wants to pass and whether he is for just repealing, or repealing and replacing - whether he’s for the Senate bill, Collins said. Trump, who had campaigned heavily on a promise to repeal and replace Obamacare, the signature legislative achievement of former Democratic President Barack Obama, took a hands-off approach to the healthcare debate last week.  On Tuesday he suggested that he was fine with letting Obamacare fail. But on Wednesday he switched course and demanded that senators stay in Washington through their planned August recess until they find common ground on healthcare. The repeal and replace bill crafted by Senate Majority Leader Mitch McConnell would leave 22 million Americans without health insurance coverage by 2026, the nonpartisan U.S. Congressional Budget Office said on Thursday. Before Trump's Wednesday lunch with 49 Republican senators, McConnell had planned to hold a straight repeal vote next week, but that appeared doomed with several Republican senators having already said they oppose that approach. The CBO said on Wednesday that 32 million more Americans would lose their insurance coverage by 2026 under a bill that would repeal much of Obamacare without a replacement. That compares with the 20 million who have become insured under Obamacare, as the Affordable Care Act is known. The Senate's number two Republican, John Cornyn, said he expected a procedural vote on Tuesday to take up a healthcare bill, but said knowing what the healthcare bill will be before the procedural vote is a luxury we don't have. An aide to Cornyn said he was referring to the amendment process that could change the bill once it is on the Senate floor. It’s difficult to predict what the final product will look like, the aide said.  Mccain's Cancer Adds Pressure Adding to Republicans' woes was news late Wednesday that Senator John McCain has aggressive brain cancer. With a narrow 52-48 Republican majority, their fight for votes becomes even more difficult. McCain, a Republican known for his feisty independence, tweeted, ... unfortunately for my sparring partners in Congress, I'll be back soon, so stand-by! As they sought to break the impasse, senators were discussing changes to Medicaid, the government healthcare program for the poor that was expanded under Obamacare. One possibility would give states flexibility to use Medicaid funding to help cover healthcare expenses of people who would lose their Medicaid coverage under the Senate bill's sharp cuts to the program. Senator Rob Portman, one of the undecideds on the healthcare bill, called the proposal progress. But Collins said she had not heard a Medicaid proposal that would tempt her to vote yes. Republicans say Obamacare is a costly intrusion into the healthcare system, but the party is divided between moderates concerned the Senate bill would eliminate insurance for millions of low-income Americans and conservatives who want to see even deeper cuts. McConnell revealed little of his next steps but said Republicans were not giving up. The fight to move beyond the status quo of Obamacare was certainly never going to be easy, he told the Senate on Thursday. But we've come a long way, and I look forward to continuing our work together to finally bring relief. The dramatic week at Congress and in the White House was taking its toll.          I'm getting a little anxious, Corker said. He said the best approach would be a repeal, with a delayed effective date by which time lawmakers could develop a replacement. Democrats, who are united in their opposition to the Republican efforts and reveled in this week's deadlock, told Republicans to abandon their healthcare efforts as they appeared no closer to reconciling policy differences after Wednesday's meeting.   It's time for Congress to pivot away from the bills that are going nowhere, said House Minority Leader Nancy Pelosi. Additional reporting by Yasmeen Abutaleb; Writing by Mary Milliken; Editing by Jonathan Oatis and Leslie Adler"
"https://www.reuters.com/article/us-chipotle-health-idUSKBN1A520G","Chipotle shares fall on Norovirus, rodent incidents","","Jul 20 2017","Chipotle Mexican Grill Inc  shares fell to a four-year low on Thursday after testing confirmed Norovirus in a customer who ate at one of the chain's Virginia restaurants and a video of rodents crawling on the floor of a Dallas shop went viral.","BOSTON (Reuters) - Chipotle Mexican Grill Inc (CMG.N) shares fell to a four-year low on Thursday after testing confirmed Norovirus in a customer who ate at one of the chain's Virginia restaurants and a video of rodents crawling on the floor of a Dallas shop went viral. Shares of the burrito chain, which has been under a microscope since it was linked to a string of food safety lapses in 2015, fell 4.5 percent to close at $356.05 on Thursday. Chipotle has worked to win back customers and rebuild the reputation of the once-high flying chain, whose stock traded well above $700 before it was connected to E. coli, Salmonella and Norovirus outbreaks in 2015. Testing confirmed Norovirus in one customer who ate at the Virginia Chipotle restaurant that was briefly closed this week following reports of diners falling ill, said Victor Avitto, environmental health supervisor for the Loudoun County Public Health Department, which has jurisdiction over the restaurant. Chipotle closed the restaurant on Monday and reopened it on Wednesday, following a deep cleaning. News of the outbreak came after more than 100 diners reported symptoms on iwaspoisoned.com, a crowd-sourced website.  Chipotle expected the confirmation, since the symptoms described by customers of the Sterling restaurant were consistent with Norovirus, spokesman Chris Arnold said.   Norovirus is the No. 1 cause of illness from contaminated food in the United States, resulting in an estimated 19 million to 21 million illnesses annually, according to the Centers for Disease Control and Prevention. It is highly contagious and can spread from person to person, as well as through food prepared by an infected person. Symptoms include cramping, nausea, vomiting, and diarrhea. Elsewhere, a customer video showing three rodents in a Chipotle restaurant in Dallas' West End neighborhood earlier this week was widely shared online. Other diners, who witnessed the lunchtime incident, told a local television station they saw rodents falling from the restaurant's ceiling. A few mice did get inside one restaurant from outside due to a small structural gap in the building, Chipotle's Arnold said on Thursday. Our management immediately removed them and the gap was quickly repaired, said Arnold, who added that the chain had contacted guests to apologize. Chipotle will report second-quarter results on July 25. Reporting by Lisa Baertlein in Boston; Editing by Meredith Mazzilli and James Dalgleish"
