url,title,tag,time,short_text,long_text
"https://www.reuters.com/article/us-health-trauma-flood-warnings-idUSKBN1AB2OO","Early warnings may blunt trauma of displacement due to flooding","","Jul 26 2017","(Reuters Health) - Early flood warnings reduce the mental health impacts of being forced to flee home because of rising waters, a UK study suggests.","(Reuters Health) - Early flood warnings reduce the mental health impacts of being forced to flee home because of rising waters, a UK study suggests. “Since people are often displaced from home and live in different places for many months, services in areas not directly affected by flooding should be alert to this increased risk and offer support as necessary,” Dr. Angie Bone, the head of Public Health England (PHE)’s Extreme Events team told Reuters Health. “A warning of at least 12 hours prior to flooding may reduce risks and is why we encourage everyone to sign up to the Environment Agency’s free flood warning service” (bit.ly/1sL3t67), Bone said by email.   Heavy rainfall across southern England in the winter of 2013-2014 washed away railroad tracks, wiped out power in many areas and forced thousands out of their homes, Bone and her colleagues write in Lancet Planetary Health. The episode was just one of eight major flooding events in England since 2000, they note in their report. Seven studies done after 2005’s Hurricane Katrina showed severe mental health effects in people displaced by flooding, the researchers point out. To better understand flooding’s long-term effects on mental health and wellbeing, PHE established the National Study of Flooding and Health.  The study previously showed that people living in areas flooded during 2013-2014 were six to seven times more likely to have depression, anxiety or PTSD one year later than those in non-flooded areas. In the new study, Bone’s team looked at whether being evacuated from home during the 2013-2014 flooding  influenced the risk of subsequent mental health problems. Displacement nearly doubled depression risk, they found, while anxiety and PTSD were about 1.7 times as common among those who left their homes. Among those who were displaced, people who had received more than 12 hours warning before flooding were less likely to have depression or PTSD one year later than those given no warning. In the United States, the National Weather Service of the National Oceanic and Atmospheric Administration issues flood watches and warnings. “As climate change progresses, flooding events are expected to increase in frequency and intensity due to rising sea levels and more frequent and extreme precipitation events. Increased urbanization will expose more people to flooding events and impacts of flooding will likely increase over the coming decades,” Shilu Tong of Shanghai Jiao Tong University in China and Queensland University in Brisbane, Australia, said by email.  Tong, who wrote an editorial accompanying the study, noted that the Australian government is taking steps to put early flood warnings in place. “Enhanced early warning systems for floods are urgently needed because climate change will probably cause more frequent and severe flooding events,” he told Reuters Health. “Affordable, good quality accommodations are necessary for individuals displaced after flooding; local authorities should identify people who are displaced after flooding who are susceptible to mental health problems, and resources directed to those people as needed; and flooded residents should be encouraged to remain at home where possible and basic services (including mental health clinics) should be put in place to enable them to do so.” SOURCE: bit.ly/2uCf2AY and bit.ly/2v01GRn Lancet Planetary Health, online June 19, 2017."
"https://www.reuters.com/article/us-eagle-pharms-fda-idUSKBN1AB2D8","FDA rejects Eagle Pharmaceuticals' heat stroke treatment","","Jul 26 2017","Eagle Pharmaceuticals Inc said on Wednesday the U.S. Food and Drug Administration declined to approve its drug Ryanodex to treat heat stroke and requested an additional clinical trial, sending its shares down 20 percent.","(Reuters) - Eagle Pharmaceuticals Inc said on Wednesday the U.S. Food and Drug Administration declined to approve its drug Ryanodex to treat heat stroke and requested an additional clinical trial, sending its shares down 20 percent. The drug, which is approved for the treatment and prevention of malignant hyperthermia, is being tested to treat exertional heat stroke (EHS), in conjunction with external cooling methods. Ryanodex brought in $4.4 million in sales in the first quarter ended March 31.  EHS is a life-threatening, heat-related illness that occurs during physical activity and is characterized by hypotension, hyperventilation and extremely high body temperature.      Eagle is reviewing its options and intends to evaluate the FDA's response to proceed with the drug's development, Chief Executive Scott Tarriff said. The FDA's request for another trial came as a surprise for Mizuho Securities USA analyst Irina Koffler, who called it the worst case scenario given the rarity of EHS and the challenges associated with a trial.  We don't know if this program will ever make it to the market, Koffler, who rates Eagle underperform, wrote in a note.    The New Jersey-based company's shares fell as much as 25.5 percent to $52.215 in afternoon trading on the Nasdaq.  The stock had declined 11.7 percent this year, as of its last close.  (Corrects to Wednesday in paragraph 1.) Reporting by Tamara Mathias in Bengaluru; Editing by Amrutha Gayathri"
"https://www.reuters.com/article/us-chipotle-health-idUSKBN1AB2LB","Chipotle served another subpoena after latest food scare","","Jul 26 2017","Chipotle Mexican Grill Inc  said U.S. federal prosecutors served a subpoena, seeking information related to a suspected norovirus outbreak at a restaurant in Sterling, Virginia that it briefly closed last week.","(Reuters) - Chipotle Mexican Grill Inc (CMG.N) said U.S. federal prosecutors served a subpoena, seeking information related to a suspected norovirus outbreak at a restaurant in Sterling, Virginia that it briefly closed last week.  The burrito chain's shares were down 1.8 percent at $342.50 in afternoon trading on Wednesday.  The latest subpoena is part of an ongoing criminal investigation being conducted by the U.S. Attorney's office for the Central District of California into a spate of E. Coli, salmonella and norovirus outbreaks at the company's outlets in late 2015 that sickened more than 100 people across states.     The July 19 subpoena is seeking information related to the incidents of illnesses associated with the Virginia restaurant, the company said in a filing.   More than 100 diners had reported norovirus like symptoms on iwaspoisoned.com, a crowd-sourced website, after eating at the restaurant.  Chipotle, which reported a better-than-expected profit on Tuesday, said it had identified a sick employee as the cause for the outbreak.  The company said it was retraining kitchen crews on food safety and enforcing a zero-tolerance policy for employees refusing to abide by new rules after the incident.. Up to Tuesday's close, the company's shares were down 6.5 percent since the Sterling incident was reported last Wednesday. Reporting by Karina Dsouza and Siddharth Cavale in Bengaluru; Editing by Anil D'Silva"
"https://www.reuters.com/article/us-health-labor-continuous-support-idUSKBN1AB2JK","Constant birth support tied to better outcomes for mothers and babies","","Jul 26 2017","(Reuters Health) - Mothers who receive continuous support during labor from a partner, friend or hospital worker may be less likely to need pain medications or have a surgical delivery than women who don’t get constant help, a research review suggests.","(Reuters Health) - Mothers who receive continuous support during labor from a partner, friend or hospital worker may be less likely to need pain medications or have a surgical delivery than women who don’t get constant help, a research review suggests. As a growing number of women in many countries are giving birth in hospitals, having continuous support during labor has become the exception rather than the norm in maternity care, researchers note in the review published by the Cochrane Library.  This type of support can include things like talking to women in labor to provide praise and reassurance, offering massage or warm baths or assistance walking to help them stay comfortable, or advocating for them. “Supportive care during labor may enhance physiological labor processes, as well as women’s feelings of control and confidence in their own strength and ability to give birth,” said lead study author Meghan Bohren, a researcher with the World Health Organization in Geneva, Switzerland.  “This may reduce the need for obstetric intervention and also improve women’s experiences,” Bohren said by email.  For the review of existing evidence, Bohren and colleagues examined data from 26 previously published studies with data on more than 15,000 women who labored in a variety of circumstances in 17 countries.  Some women in the studies received continuous labor support from partners, mothers, friends or other family members, while others got this support from nurses, midwives, doulas or other women who weren’t hospital employees.  With continuous support, women were more likely to have vaginal deliveries than when they didn’t have this constant help, the review found.  In addition, women with continuous support were less likely to use pain medications and appeared more likely to have shorter labors and be satisfied with the delivery experience.  Babies born to mothers with continuous support were less likely to have low Apgar scores, an assessment of wellbeing that examines things like breathing and pulse shortly after birth.  Researchers did not, however, find a difference in the odds of babies being admitted to intensive care or being breastfed after two months based on whether or not mothers received continuous birth support.  Benefits of constant support appeared more pronounced in high-income countries than in less affluent nations, and there wasn’t enough evidence to determine how much this helped mothers and babies in low-income countries.  The main limitation of the review was the quality of evidence in the smaller studies was generally low, making it hard to draw broad conclusions from an analysis of multiple research efforts, the authors note.  Even so, the results underscore the potential for mothers and babies alike to benefit from continuous labor support, said Erin M Wright, a researcher at Johns Hopkins University School of Nursing in Baltimore, Maryland, and a practicing midwife at Johns Hopkins Bayview Medical Center. “This kind of support can help reduce interventions in labor such as medication use for pain relief, which can have a variety of side effects resulting in the need for further interventions,” Wright, who wasn’t involved in the study, said by email.  “These can end up resulting in the need for a cesarean delivery or use of forceps or vacuum,” Wright added. “Continuous labor support, however, is the only intervention repeatedly demonstrated to have no adverse effects.” SOURCE: bit.ly/2uZmI2w Cochrane Library, online July 6, 2017."
"https://www.reuters.com/article/us-gsk-results-rare-diseases-idUSKBN1AB2EE","GSK gives up on rare diseases as gene therapy gets two customers","","Jul 26 2017","GlaxoSmithKline is swimming against the tide by getting out of treatments for rare diseases at a time when rivals like Sanofi and Shire see the field as a rich seam for profits.","LONDON (Reuters) - GlaxoSmithKline is swimming against the tide by getting out of treatments for rare diseases at a time when rivals like Sanofi and Shire see the field as a rich seam for profits. Successful medicines for rare conditions are potentially very lucrative, since prices frequently run into hundreds of thousands of dollars, but patient numbers can be extremely low. New GSK Chief Executive Emma Walmsley announced the strategic review and potential divestment of rare diseases on Wednesday as part of a wide-ranging drive to streamline pharmaceutical operations. It follows a less than impressive experience for GSK in the field, including the fact that its pioneering gene therapy Strimvelis only secured its first commercial patient in March, 10 months after it was approved for sale in Europe in May 2016. Since then a second patient has also been treated and two more are lined up to receive the therapy commercially, a spokesman said. Strimvelis, which GSK developed with Italian scientists, is designed for a tiny number of children with ADA Severe Combined Immune Deficiency (ADA-SCID). SCID is sometimes known as bubble baby disease, since those born with it have immune systems so weak they must live in germ-free environments. The new treatment became the first life-saving gene therapy for children when it was approved last year, marking a step forward for the emerging technology to fix faulty genes. Walmsley said GSK was not giving up on gene and cell therapy entirely. Research will be focused in future in areas with larger potential patient numbers, including oncology. Reporting by Ben Hirschler; Editing by Adrian Croft"
"https://www.reuters.com/article/us-health-eczema-steroid-phobia-idUSKBN1AB2D6","Fear keeps many eczema patients from using steroid creams","","Jul 26 2017","(Reuters Health) - Many people with eczema, a common skin disease, may avoid creams and ointments that can help ease symptoms like itching and inflammation because they’re afraid to try topical corticosteroids, a recent study suggests.","(Reuters Health) - Many people with eczema, a common skin disease, may avoid creams and ointments that can help ease symptoms like itching and inflammation because they’re afraid to try topical corticosteroids, a recent study suggests.  Eczema, also known as atopic dermatitis, usually develops in early childhood and often runs in families. Scaly, itchy rashes are the main symptoms. The condition can be treated using moisturizers, avoiding certain soaps and other irritants and with prescription creams and ointments containing corticosteroids to relieve itching.  For the study, researchers examined results from 16 previously published studies and found as many as four in five people were afraid to use corticosteroids for eczema. Between one third and one half of people who were prescribed steroid creams but also expressed concerns about them did not adhere to the treatment - meaning they didn’t use the creams and missed out on their benefits.  “Steroids have developed a bad reputation because of the potential side effects that come with improper or chronic use of high-potency steroids,” said senior study author Dr. Richard Antaya, director of pediatric dermatology at Yale School of Medicine in New Haven, Connecticut.  Common side effects of corticosteroids can include stretch marks as well as thinning, thickening or darkening of the skin. Less often, these steroids can cause acne or infected hair follicles or more serious side effects in the eyes like glaucoma and cataracts.  “The resistance to using topical corticosteroids is definitely partly driven by the confusion over the adverse effects of long term use of high potency steroids versus those of short term use of low potency steroids,” Antaya said by email. “The risks from using short-term low potency steroids are vastly lower.” For the study, Antaya and colleagues examined studies published from 1946 to 2016 that surveyed patients and caregivers about their opinions of topical corticosteroids. The studies included in the analysis were done in Australia, Canada, Croatia, France, Germany, Hong Kong, Japan, Korea, Mexico, the Netherlands, Poland, Singapore and the U.S. Two studies compared how often patients used these medicines based on whether or not they had phobias.  In one of these studies, 49 percent of people with phobias didn’t adhere to a prescribed steroid cream, compared with 14 percent of patients without concerns. In the second study, 29 percent of people with phobias didn’t use their steroid cream, compared with 10 percent of patients who weren’t worried. Five of the studies in the analysis looked at why people had phobias and found skin thinning was the most frequent concern, followed by fear that steroids might affect growth and development. Some previous research has found long-term use at high doses may impact growth and development in children.  Limitations of the study include the wide variety of phobia definitions used across the 16 smaller studies in the analysis, the authors note in JAMA Dermatology.  Even so, the findings add to evidence that phobias keep many parents in many parts of the world from using corticosteroids to treat their children with eczema, said Dr. Saxon Smith, a dermatologist at the School of Medicine at the University of Sydney in Australia.  “It is critical to recognize the high frequency of fears patients and parents have about using topical corticosteroids,” Smith, who wasn’t involved in the study, said by email.  Left untreated, eczema doesn’t just leave kids itchy, Smith said. Itchy and discomfort can be so severe that kids don’t sleep at night, impacting normal development and socialization.  “Too often we see infants who suffer and have not slept for months and parents exhausted just because they have wrong fear or beliefs about the treatment or the disease and don’t treat their child,” Dr. Helene Aubert-Wastiaux, a dermatologist at Nantes University Hospital in France who wasn’t involved in the study, said by email.  SOURCE: bit.ly/2tZvKrU JAMA Dermatology, online July 19, 2017."
"https://www.reuters.com/article/us-mckesson-meeting-idUSKBN1AB20K","McKesson shareholders vote against executive pay structure","","Jul 26 2017","McKesson Corp's shareholders voted against the company's executive pay policy, following a campaign that criticized the drug wholesaler for its role in the U.S. opioid drug epidemic.","(Reuters) - McKesson Corp's shareholders voted against the company's executive pay policy, following a campaign that criticized the drug wholesaler for its role in the U.S. opioid drug epidemic. Three U.S. state treasurers and the International Brotherhood of Teamsters campaigned against McKesson's pay practices and urged it to appoint an independent chairman. The Compensation Committee will conduct a thorough review of the current executive compensation plan and consider implementing changes that further drive alignment between incentives and shareholder value, McKesson said on Wednesday. The company also said it would split the role of chairman and CEO in the future, commencing with its next CEO. Shareholders Teamsters and state treasurers from Illinois, Pennsylvania and West Virginia urged McKesson to take stringent efforts to combat the opioid epidemic plaguing the country. Opioid drugs, including prescription painkillers and heroin, killed more than 33,000 people in 2015, according to the Centers for Disease Control and Prevention (CDC), and have led to widespread regulatory and federal response. Another bone of contention for shareholders was McKesson Chief Executive John Hammergren's compensation. Hammergren was paid more than $20 million for the year ended March 31, despite a record $150 million settlement that McKesson paid to resolve a U.S. probe into whether it failed to report suspicious orders of addictive painkillers. Teamsters said on Wednesday the change in policy would hopefully provide greater oversight and accountability for how prescription drugs are distributed in the United States. This shareholder vote should serve as a wake-up call to AmerisourceBergen, Cardinal Health and other companies involved in the manufacturing or distribution of prescription opioids. McKesson and rivals AmerisourceBergen Corp and Cardinal Health have been sued by several West Virginia counties for failing to report suspicious orders of opioids. Shares of McKesson, which is due to report its quarterly results on Thursday, were down 1 percent at $165.80 in afternoon trading on Wednesday. Reporting by Tamara Mathias and Ankur Banerjee  in Bengaluru; Editing by Martina D'Couto"
"https://www.reuters.com/article/us-dynavax-techs-fda-vaccine-idUSKBN1AB1Q0","Dynavax hepatitis B vaccine works; raises safety issues: FDA","","Jul 26 2017","Dynavax Technologies Corp's experimental hepatitis B vaccine is effective, but there were more deaths and serious heart problems in patients given the vaccine than in those given a rival product, according to a preliminary Food and Drug Administration report published on Wednesday.","(Reuters) - Dynavax Technologies Corp's experimental hepatitis B vaccine is effective, but there were more deaths and serious heart problems in patients given the vaccine than in those given a rival product, according to a preliminary Food and Drug Administration report published on Wednesday. However, overall numbers and rates of such cardiac events were low, the review concluded, and there were limitations in the evaluation of cardiac events that limits the causal interpretation of these observations. The review, posted on the FDA's website, comes two days ahead of a meeting of outside advisors who will discuss the vaccine, Heplisav-B, and recommend whether it should be approved. The FDA is not bound to follow the advice of its advisory panels but typically does so. The FDA has twice rejected the product citing unresolved safety concerns. The second rejection, in November, sent Dynavax's shares plunging roughly 70 percent to a year low of $3.20. They have since bounced back and were trading down 0.8 percent at $9.83 on Wednesday. Anupam Rama, an analyst at J.P. Morgan, currently estimates the likelihood of approval at 40 percent given the mixed opinions in the FDA's briefing documents and previous rejections, a position that may change following the advisory committee meeting, he said in a research note on Wednesday. If the vaccine is approved, Dynavax's shares could rise into the mid-to-high teens, he added. Dynavax argues that the higher number of heart problems, including heart attack, recorded with Heplisav-B is due to fewer than expected instances occurring in the group of patients who took GlaxoSmithKline Plc's Engerix-B. One cardiologist consulted by the FDA said the argument appears plausible and suggested the imbalance should be noted on the product's label and safety monitoring should continue after it reaches the market. Two other cardiologists were less sure. While the finding could be attributable to chance, I cannot confidently say that there is no increased cardiovascular risk with Heplisav, said one. The other stated that Dynavax cannot/does not fully eliminate the notion that this is a real observation worth further investigation. I agree. Heplisav-B is designed to enhance the body's immune response to the hepatitis B virus, which can lead to cirrhosis of the liver, cancer and death. The virus is spread through sexual contact, sharing of needles and from mother to child during pregnancy. Reporting by Toni Clarke in Washington; Editing by Frances Kerry"
